{
  "$schema": "http://json-schema.org/draft-07/schema#",
  "$id": "https://trustx.example/schema/entry.schema.json",
  "title": "AI Agent Risk Registry Entry (PLACEHOLDER)",
  "description": "PLACEHOLDER schema for a single AI-agent risk-registry entry. The four scored dimensions below (autonomy, delegated_authority, tool_access, data_exposure) are SAMPLES ONLY and MUST be swapped for RAI's real 12-dimension model when it lands. Do not treat these four as the canonical taxonomy.",
  "type": "object",
  "additionalProperties": false,
  "required": ["agent", "dimensions", "risk_tier", "provenance"],
  "properties": {
    "agent": {
      "type": "object",
      "additionalProperties": false,
      "required": ["slug", "description"],
      "properties": {
        "slug": {
          "type": "string",
          "pattern": "^[a-z0-9]+(?:-[a-z0-9]+)*$",
          "description": "URL-safe identifier, e.g. 'invoice-payer'."
        },
        "description": {
          "type": "string",
          "minLength": 1,
          "description": "Free-text description of the agent that was classified."
        }
      }
    },
    "dimensions": {
      "type": "object",
      "description": "PLACEHOLDER: 4 sample risk dimensions. SWAP FOR RAI'S REAL 12 DIMENSIONS.",
      "additionalProperties": false,
      "required": ["autonomy", "delegated_authority", "tool_access", "data_exposure"],
      "properties": {
        "autonomy": { "$ref": "#/$defs/dimension" },
        "delegated_authority": { "$ref": "#/$defs/dimension" },
        "tool_access": { "$ref": "#/$defs/dimension" },
        "data_exposure": { "$ref": "#/$defs/dimension" }
      }
    },
    "risk_tier": {
      "type": "string",
      "enum": ["low", "medium", "high"],
      "description": "Rolled-up risk tier derived from the dimension scores."
    },
    "challenge": {
      "type": "object",
      "description": "Record of the challenger (red-team) pass over the proposal.",
      "additionalProperties": false,
      "required": ["flagged", "notes", "iterations"],
      "properties": {
        "flagged": {
          "type": "boolean",
          "description": "True if the challenger flagged any unsupported score."
        },
        "notes": {
          "type": "array",
          "items": { "type": "string" },
          "description": "Human-readable challenge notes, including any deterministic overrides that fired."
        },
        "iterations": {
          "type": "integer",
          "minimum": 1,
          "description": "Number of proposer iterations that ran (bounded; max 2)."
        }
      }
    },
    "provenance": {
      "type": "object",
      "additionalProperties": false,
      "required": ["submitted_by", "approved_by", "timestamp"],
      "properties": {
        "submitted_by": {
          "type": "string",
          "description": "Who/what submitted the draft (e.g. 'classifier' or an operator id)."
        },
        "approved_by": {
          "type": ["string", "null"],
          "description": "Accountable human who ratified the entry. Null until ratified."
        },
        "timestamp": {
          "type": "string",
          "format": "date-time",
          "description": "ISO-8601 timestamp of ratification."
        }
      }
    }
  },
  "$defs": {
    "dimension": {
      "type": "object",
      "additionalProperties": false,
      "required": ["score", "rationale", "evidence"],
      "properties": {
        "score": {
          "type": "integer",
          "minimum": 1,
          "maximum": 5,
          "description": "Risk score for this dimension, 1 (lowest) to 5 (highest)."
        },
        "rationale": {
          "type": "string",
          "minLength": 1,
          "description": "One-line justification for the score."
        },
        "evidence": {
          "type": "array",
          "items": { "type": "string" },
          "description": "Evidence pointers supporting the score (quotes from the description, links, doc refs). May be empty for a draft but SHOULD be populated for a defensible entry."
        }
      }
    }
  }
}
